{
  "$schema": "schema/video_construct_scores.schema.json",
  "artifact": "construct_scores",
  "student_id": "Zabby",
  "cohort_year": 2025,
  "rubric_id": "codap_arbor_v4_candidate",
  "schema_version": "4.1",
  "generated_at": "2026-07-20T11:17:56.845472+00:00",
  "session_scores": {},
  "session_notes": null,
  "key_evidence": {},
  "audio_available": null,
  "step_level_inferences": [
    {
      "step_index": 0,
      "behavior_codes": [
        "LOAD_DATASET",
        "OPEN_ARBOR"
      ],
      "behavior_details": [
        {
          "code": "LOAD_DATASET",
          "gloss": "Dataset is loaded into CODAP/Arbor.",
          "screen_change": "Table/case-card region populates with Food Data attributes and rows."
        },
        {
          "code": "OPEN_ARBOR",
          "gloss": "Arbor / CODAP workspace is opened or restarted.",
          "screen_change": "Arbor tree canvas appears empty/reset; plugin chrome becomes visible."
        }
      ],
      "construct_levels_hint": {
        "bilişsel_davranış_kategorisi": "EXPLORE",
        "unesco_ai_cft_level": "Acquire"
      },
      "certainty": "exact",
      "silver_confidence": "high",
      "silver_frame_id": "frame_0014"
    },
    {
      "step_index": 1,
      "behavior_codes": [
        "CREATE_GRAPH",
        "SET_AXIS"
      ],
      "behavior_details": [
        {
          "code": "CREATE_GRAPH",
          "gloss": "A CODAP graph panel is created.",
          "screen_change": "New CODAP graph panel opens (often beside Arbor)."
        },
        {
          "code": "SET_AXIS",
          "gloss": "Graph axis attribute is assigned or changed.",
          "screen_change": "Graph marks/points reconfigure to the assigned X/Y attribute."
        }
      ],
      "construct_levels_hint": {
        "bilişsel_davranış_kategorisi": "EXPLORE",
        "unesco_ai_cft_level": "Acquire"
      },
      "certainty": "exact",
      "silver_confidence": "high",
      "silver_frame_id": "frame_0033"
    },
    {
      "step_index": 2,
      "behavior_codes": [
        "SET_AXIS"
      ],
      "behavior_details": [
        {
          "code": "SET_AXIS",
          "gloss": "Graph axis attribute is assigned or changed.",
          "screen_change": "Graph marks/points reconfigure to the assigned X/Y attribute."
        }
      ],
      "construct_levels_hint": {
        "bilişsel_davranış_kategorisi": "EXPLORE",
        "unesco_ai_cft_level": "Acquire"
      },
      "certainty": "exact",
      "silver_confidence": "high",
      "silver_frame_id": "frame_0031"
    },
    {
      "step_index": 3,
      "behavior_codes": [
        "SET_TARGET_ATTRIBUTE",
        "DRAG_SPLIT_ATTRIBUTE",
        "ASSIGN_LEAF_LABEL"
      ],
      "behavior_details": [
        {
          "code": "SET_TARGET_ATTRIBUTE",
          "gloss": "Target / predict attribute is set on the tree.",
          "screen_change": "Tree root shows selected dependent variable name."
        },
        {
          "code": "DRAG_SPLIT_ATTRIBUTE",
          "gloss": "A predictor attribute is dragged onto a tree depth/node.",
          "screen_change": "Tree node gains a split attribute and child branches appear/update."
        },
        {
          "code": "ASSIGN_LEAF_LABEL",
          "gloss": "Leaf / side of a split is labeled recommendable vs not.",
          "screen_change": "Leaf badges show recommendable / not recommendable."
        }
      ],
      "construct_levels_hint": {
        "bilişsel_davranış_kategorisi": "TUNE",
        "unesco_ai_cft_level": "Acquire"
      },
      "certainty": "exact",
      "silver_confidence": "high",
      "silver_frame_id": "frame_0056"
    },
    {
      "step_index": 4,
      "behavior_codes": [
        "DRAG_SPLIT_ATTRIBUTE"
      ],
      "behavior_details": [
        {
          "code": "DRAG_SPLIT_ATTRIBUTE",
          "gloss": "A predictor attribute is dragged onto a tree depth/node.",
          "screen_change": "Tree node gains a split attribute and child branches appear/update."
        }
      ],
      "construct_levels_hint": {
        "bilişsel_davranış_kategorisi": "TUNE",
        "unesco_ai_cft_level": "Acquire"
      },
      "certainty": "exact",
      "silver_confidence": "high",
      "silver_frame_id": "frame_0059"
    },
    {
      "step_index": 5,
      "behavior_codes": [
        "DRAG_SPLIT_ATTRIBUTE",
        "ASSIGN_LEAF_LABEL"
      ],
      "behavior_details": [
        {
          "code": "DRAG_SPLIT_ATTRIBUTE",
          "gloss": "A predictor attribute is dragged onto a tree depth/node.",
          "screen_change": "Tree node gains a split attribute and child branches appear/update."
        },
        {
          "code": "ASSIGN_LEAF_LABEL",
          "gloss": "Leaf / side of a split is labeled recommendable vs not.",
          "screen_change": "Leaf badges show recommendable / not recommendable."
        }
      ],
      "construct_levels_hint": {
        "bilişsel_davranış_kategorisi": "TUNE",
        "unesco_ai_cft_level": "Acquire"
      },
      "certainty": "exact",
      "silver_confidence": "high",
      "silver_frame_id": "frame_0065"
    },
    {
      "step_index": 6,
      "behavior_codes": [
        "DRAG_SPLIT_ATTRIBUTE",
        "DELETE_TREE_OR_CTR_ROW",
        "SEEK_HELP_OR_DIALOGUE"
      ],
      "behavior_details": [
        {
          "code": "DRAG_SPLIT_ATTRIBUTE",
          "gloss": "A predictor attribute is dragged onto a tree depth/node.",
          "screen_change": "Tree node gains a split attribute and child branches appear/update."
        },
        {
          "code": "DELETE_TREE_OR_CTR_ROW",
          "gloss": "Tree is cleared or a CTR row is deleted.",
          "screen_change": "Tree canvas clears or a CTR row disappears."
        },
        {
          "code": "SEEK_HELP_OR_DIALOGUE",
          "gloss": "Verbal help-seeking or teacher–student dialogue is recorded.",
          "screen_change": "Screen may be static while conversation occurs."
        }
      ],
      "construct_levels_hint": {
        "bilişsel_davranış_kategorisi": "EVALUATE",
        "unesco_ai_cft_level": "Acquire"
      },
      "certainty": "exact",
      "silver_confidence": "high",
      "silver_frame_id": "frame_0087"
    },
    {
      "step_index": 7,
      "behavior_codes": [
        "UPDATE_THRESHOLD"
      ],
      "behavior_details": [
        {
          "code": "UPDATE_THRESHOLD",
          "gloss": "Numeric split threshold on the tree is changed.",
          "screen_change": "Split cut-point text/value on the node changes; leaf purity may change."
        }
      ],
      "construct_levels_hint": {
        "bilişsel_davranış_kategorisi": "TUNE",
        "unesco_ai_cft_level": "Acquire"
      },
      "certainty": "exact",
      "silver_confidence": "high",
      "silver_frame_id": "frame_0090"
    },
    {
      "step_index": 8,
      "behavior_codes": [
        "UPDATE_THRESHOLD"
      ],
      "behavior_details": [
        {
          "code": "UPDATE_THRESHOLD",
          "gloss": "Numeric split threshold on the tree is changed.",
          "screen_change": "Split cut-point text/value on the node changes; leaf purity may change."
        }
      ],
      "construct_levels_hint": {
        "bilişsel_davranış_kategorisi": "TUNE",
        "unesco_ai_cft_level": "Acquire"
      },
      "certainty": "exact",
      "silver_confidence": "high",
      "silver_frame_id": "frame_0091"
    },
    {
      "step_index": 9,
      "behavior_codes": [
        "UPDATE_MOVABLE_VALUE"
      ],
      "behavior_details": [
        {
          "code": "UPDATE_MOVABLE_VALUE",
          "gloss": "Movable value position is updated (visual threshold probe on graph).",
          "screen_change": "Movable line shifts; case partitions on either side change."
        }
      ],
      "construct_levels_hint": {
        "bilişsel_davranış_kategorisi": "TUNE",
        "unesco_ai_cft_level": "Acquire"
      },
      "certainty": "exact",
      "silver_confidence": "high",
      "silver_frame_id": "frame_0096"
    },
    {
      "step_index": 10,
      "behavior_codes": [
        "DRAG_SPLIT_ATTRIBUTE"
      ],
      "behavior_details": [
        {
          "code": "DRAG_SPLIT_ATTRIBUTE",
          "gloss": "A predictor attribute is dragged onto a tree depth/node.",
          "screen_change": "Tree node gains a split attribute and child branches appear/update."
        }
      ],
      "construct_levels_hint": {
        "bilişsel_davranış_kategorisi": "TUNE",
        "unesco_ai_cft_level": "Acquire"
      },
      "certainty": "exact",
      "silver_confidence": "high",
      "silver_frame_id": "frame_0097"
    },
    {
      "step_index": 11,
      "behavior_codes": [
        "UPDATE_THRESHOLD"
      ],
      "behavior_details": [
        {
          "code": "UPDATE_THRESHOLD",
          "gloss": "Numeric split threshold on the tree is changed.",
          "screen_change": "Split cut-point text/value on the node changes; leaf purity may change."
        }
      ],
      "construct_levels_hint": {
        "bilişsel_davranış_kategorisi": "TUNE",
        "unesco_ai_cft_level": "Acquire"
      },
      "certainty": "exact",
      "silver_confidence": "high",
      "silver_frame_id": "frame_0097"
    },
    {
      "step_index": 12,
      "behavior_codes": [
        "UPDATE_THRESHOLD",
        "ASSIGN_LEAF_LABEL",
        "SEEK_HELP_OR_DIALOGUE"
      ],
      "behavior_details": [
        {
          "code": "UPDATE_THRESHOLD",
          "gloss": "Numeric split threshold on the tree is changed.",
          "screen_change": "Split cut-point text/value on the node changes; leaf purity may change."
        },
        {
          "code": "ASSIGN_LEAF_LABEL",
          "gloss": "Leaf / side of a split is labeled recommendable vs not.",
          "screen_change": "Leaf badges show recommendable / not recommendable."
        },
        {
          "code": "SEEK_HELP_OR_DIALOGUE",